2026-01-16 21:13:33,929 - orchestrator - INFO - Starting single-agent patching run for CVE-2022-39286
2026-01-16 21:13:33,929 - orchestrator - INFO - Starting single-agent patching run for CVE-2022-39286
2026-01-16 21:13:33,930 - orchestrator - INFO - Using container: single_agent_cve-2022-39286_a9b3fc80, work_dir: /workspace/jupyter_core
2026-01-16 21:13:33,930 - orchestrator - INFO - Using container: single_agent_cve-2022-39286_a9b3fc80, work_dir: /workspace/jupyter_core
2026-01-16 21:13:33,937 - src.agents.base - INFO - SingleAgent - LLM call prompt (1747 chars):
## Your Mission

Fix the security vulnerability in this codebase.

## Vulnerability Details

**CVE:** CVE-2022-39286
**CWE:** ['CWE-285', 'CWE-250', 'CWE-269']
**Affected File:** jupyter_core/application.py

**Vulnerable Locations:**
Not provided

### Description
No description provided. You'll need to investigate.

### Vulnerable Code Snippet (may be stale vs line numbers)
```Python
    def config_file_paths(self):
        path = jupyter_config_path()
        if self.config_dir not in path:
            path.insert(0, self.config_dir)
        path.insert(0, os.getcwd())
        return path
```

## Your Task

Execute the complete patching workflow autonomously:

1. **ANALYZE**: Read and understand the vulnerable code
   - Use ReadFile to examine the full file
   - Use FindClass to understand dependencies
   - Identify the root cause based on CWE/CVE information
   - Account for **all** listed vulnerable locations (multiple hunks/files may be affected)

2. **PLAN**: Formulate your fix strategy
   - Decide what needs to change and why
   - Consider security completeness and edge cases
   - Keep changes minimal and focused

3. **IMPLEMENT**: Apply the patch
   - Use EditCode to modify the vulnerable code
   - Ensure complete, valid, syntactically correct code
   - Preserve existing style and conventions

4. **VERIFY**: Run tests to validate
   - Use RunTest to execute PoC and unit tests
   - Read test output carefully to determine pass/fail
   - Verify both security fix and no regressions

5. **ITERATE**: If tests fail, adjust and retry
   - Analyze what went wrong
   - Try a different approach
   - Don't repeat the same mistake

You have all the tools and knowledge you need. Work autonomously and systematically.

Begin!

2026-01-16 21:13:33,937 - src.agents.base - INFO - SingleAgent - LLM call prompt (1747 chars):
## Your Mission

Fix the security vulnerability in this codebase.

## Vulnerability Details

**CVE:** CVE-2022-39286
**CWE:** ['CWE-285', 'CWE-250', 'CWE-269']
**Affected File:** jupyter_core/application.py

**Vulnerable Locations:**
Not provided

### Description
No description provided. You'll need to investigate.

### Vulnerable Code Snippet (may be stale vs line numbers)
```Python
    def config_file_paths(self):
        path = jupyter_config_path()
        if self.config_dir not in path:
            path.insert(0, self.config_dir)
        path.insert(0, os.getcwd())
        return path
```

## Your Task

Execute the complete patching workflow autonomously:

1. **ANALYZE**: Read and understand the vulnerable code
   - Use ReadFile to examine the full file
   - Use FindClass to understand dependencies
   - Identify the root cause based on CWE/CVE information
   - Account for **all** listed vulnerable locations (multiple hunks/files may be affected)

2. **PLAN**: Formulate your fix strategy
   - Decide what needs to change and why
   - Consider security completeness and edge cases
   - Keep changes minimal and focused

3. **IMPLEMENT**: Apply the patch
   - Use EditCode to modify the vulnerable code
   - Ensure complete, valid, syntactically correct code
   - Preserve existing style and conventions

4. **VERIFY**: Run tests to validate
   - Use RunTest to execute PoC and unit tests
   - Read test output carefully to determine pass/fail
   - Verify both security fix and no regressions

5. **ITERATE**: If tests fail, adjust and retry
   - Analyze what went wrong
   - Try a different approach
   - Don't repeat the same mistake

You have all the tools and knowledge you need. Work autonomously and systematically.

Begin!

2026-01-16 21:13:35,883 - src.agents.base - INFO - SingleAgent executing tool: ReadFile
2026-01-16 21:13:35,883 - src.agents.base - INFO - SingleAgent executing tool: ReadFile
2026-01-16 21:13:35,883 - src.agents.base - INFO - Tool arguments:
{
  "file_path": "jupyter_core/application.py",
  "start_line": 1,
  "end_line": 100
}
2026-01-16 21:13:35,883 - src.agents.base - INFO - Tool arguments:
{
  "file_path": "jupyter_core/application.py",
  "start_line": 1,
  "end_line": 100
}
2026-01-16 21:13:36,089 - src.agents.base - INFO - Tool ReadFile: ✓
2026-01-16 21:13:36,089 - src.agents.base - INFO - Tool ReadFile: ✓
2026-01-16 21:13:37,066 - src.agents.base - INFO - SingleAgent executing tool: FindClass
2026-01-16 21:13:37,066 - src.agents.base - INFO - SingleAgent executing tool: FindClass
2026-01-16 21:13:37,067 - src.agents.base - INFO - Tool arguments:
{
  "symbol_name": "config_file_paths",
  "search_type": "usage",
  "file_pattern": "*.py"
}
2026-01-16 21:13:37,067 - src.agents.base - INFO - Tool arguments:
{
  "symbol_name": "config_file_paths",
  "search_type": "usage",
  "file_pattern": "*.py"
}
2026-01-16 21:13:37,239 - src.agents.base - INFO - Tool FindClass: ✓
2026-01-16 21:13:37,239 - src.agents.base - INFO - Tool FindClass: ✓
2026-01-16 21:13:38,422 - src.agents.base - INFO - SingleAgent executing tool: ReadFile
2026-01-16 21:13:38,422 - src.agents.base - INFO - SingleAgent executing tool: ReadFile
2026-01-16 21:13:38,423 - src.agents.base - INFO - Tool arguments:
{
  "file_path": "jupyter_core/application.py",
  "start_line": 170,
  "end_line": 210
}
2026-01-16 21:13:38,423 - src.agents.base - INFO - Tool arguments:
{
  "file_path": "jupyter_core/application.py",
  "start_line": 170,
  "end_line": 210
}
2026-01-16 21:13:38,575 - src.agents.base - INFO - Tool ReadFile: ✓
2026-01-16 21:13:38,575 - src.agents.base - INFO - Tool ReadFile: ✓
2026-01-16 21:13:39,677 - src.agents.base - INFO - SingleAgent executing tool: ReadFile
2026-01-16 21:13:39,677 - src.agents.base - INFO - SingleAgent executing tool: ReadFile
2026-01-16 21:13:39,677 - src.agents.base - INFO - Tool arguments:
{
  "file_path": "jupyter_core/application.py",
  "start_line": 101,
  "end_line": 170
}
2026-01-16 21:13:39,677 - src.agents.base - INFO - Tool arguments:
{
  "file_path": "jupyter_core/application.py",
  "start_line": 101,
  "end_line": 170
}
2026-01-16 21:13:39,834 - src.agents.base - INFO - Tool ReadFile: ✓
2026-01-16 21:13:39,834 - src.agents.base - INFO - Tool ReadFile: ✓
2026-01-16 21:13:40,803 - src.agents.base - INFO - SingleAgent executing tool: ReadFile
2026-01-16 21:13:40,803 - src.agents.base - INFO - SingleAgent executing tool: ReadFile
2026-01-16 21:13:40,804 - src.agents.base - INFO - Tool arguments:
{
  "file_path": "jupyter_core/application.py",
  "start_line": 1,
  "end_line": 250
}
2026-01-16 21:13:40,804 - src.agents.base - INFO - Tool arguments:
{
  "file_path": "jupyter_core/application.py",
  "start_line": 1,
  "end_line": 250
}
2026-01-16 21:13:40,959 - src.agents.base - INFO - Tool ReadFile: ✓
2026-01-16 21:13:40,959 - src.agents.base - INFO - Tool ReadFile: ✓
2026-01-16 21:13:43,142 - src.agents.base - INFO - SingleAgent executing tool: ReadFile
2026-01-16 21:13:43,142 - src.agents.base - INFO - SingleAgent executing tool: ReadFile
2026-01-16 21:13:43,143 - src.agents.base - INFO - Tool arguments:
{
  "file_path": "jupyter_core/paths.py",
  "start_line": 1,
  "end_line": 60
}
2026-01-16 21:13:43,143 - src.agents.base - INFO - Tool arguments:
{
  "file_path": "jupyter_core/paths.py",
  "start_line": 1,
  "end_line": 60
}
2026-01-16 21:13:43,295 - src.agents.base - INFO - Tool ReadFile: ✓
2026-01-16 21:13:43,295 - src.agents.base - INFO - Tool ReadFile: ✓
2026-01-16 21:13:44,504 - src.agents.base - INFO - SingleAgent executing tool: ReadFile
2026-01-16 21:13:44,504 - src.agents.base - INFO - SingleAgent executing tool: ReadFile
2026-01-16 21:13:44,505 - src.agents.base - INFO - Tool arguments:
{
  "file_path": "jupyter_core/paths.py",
  "start_line": 61,
  "end_line": 120
}
2026-01-16 21:13:44,505 - src.agents.base - INFO - Tool arguments:
{
  "file_path": "jupyter_core/paths.py",
  "start_line": 61,
  "end_line": 120
}
2026-01-16 21:13:44,655 - src.agents.base - INFO - Tool ReadFile: ✓
2026-01-16 21:13:44,655 - src.agents.base - INFO - Tool ReadFile: ✓
2026-01-16 21:13:45,539 - src.agents.base - INFO - SingleAgent executing tool: ReadFile
2026-01-16 21:13:45,539 - src.agents.base - INFO - SingleAgent executing tool: ReadFile
2026-01-16 21:13:45,540 - src.agents.base - INFO - Tool arguments:
{
  "file_path": "jupyter_core/paths.py",
  "start_line": 121,
  "end_line": 180
}
2026-01-16 21:13:45,540 - src.agents.base - INFO - Tool arguments:
{
  "file_path": "jupyter_core/paths.py",
  "start_line": 121,
  "end_line": 180
}
2026-01-16 21:13:45,690 - src.agents.base - INFO - Tool ReadFile: ✓
2026-01-16 21:13:45,690 - src.agents.base - INFO - Tool ReadFile: ✓
2026-01-16 21:13:46,584 - src.agents.base - INFO - SingleAgent executing tool: ReadFile
2026-01-16 21:13:46,584 - src.agents.base - INFO - SingleAgent executing tool: ReadFile
2026-01-16 21:13:46,584 - src.agents.base - INFO - Tool arguments:
{
  "file_path": "jupyter_core/paths.py",
  "start_line": 181,
  "end_line": 240
}
2026-01-16 21:13:46,584 - src.agents.base - INFO - Tool arguments:
{
  "file_path": "jupyter_core/paths.py",
  "start_line": 181,
  "end_line": 240
}
2026-01-16 21:13:46,730 - src.agents.base - INFO - Tool ReadFile: ✓
2026-01-16 21:13:46,730 - src.agents.base - INFO - Tool ReadFile: ✓
2026-01-16 21:13:47,665 - src.agents.base - INFO - SingleAgent executing tool: ReadFile
2026-01-16 21:13:47,665 - src.agents.base - INFO - SingleAgent executing tool: ReadFile
2026-01-16 21:13:47,666 - src.agents.base - INFO - Tool arguments:
{
  "file_path": "jupyter_core/paths.py",
  "start_line": 241,
  "end_line": 300
}
2026-01-16 21:13:47,666 - src.agents.base - INFO - Tool arguments:
{
  "file_path": "jupyter_core/paths.py",
  "start_line": 241,
  "end_line": 300
}
2026-01-16 21:13:47,804 - src.agents.base - INFO - Tool ReadFile: ✓
2026-01-16 21:13:47,804 - src.agents.base - INFO - Tool ReadFile: ✓
2026-01-16 21:13:48,796 - src.agents.base - INFO - SingleAgent executing tool: ReadFile
2026-01-16 21:13:48,796 - src.agents.base - INFO - SingleAgent executing tool: ReadFile
2026-01-16 21:13:48,796 - src.agents.base - INFO - Tool arguments:
{
  "file_path": "jupyter_core/application.py",
  "start_line": 251,
  "end_line": 300
}
2026-01-16 21:13:48,796 - src.agents.base - INFO - Tool arguments:
{
  "file_path": "jupyter_core/application.py",
  "start_line": 251,
  "end_line": 300
}
2026-01-16 21:13:48,940 - src.agents.base - INFO - Tool ReadFile: ✓
2026-01-16 21:13:48,940 - src.agents.base - INFO - Tool ReadFile: ✓
2026-01-16 21:13:50,468 - src.agents.base - INFO - SingleAgent executing tool: ReadFile
2026-01-16 21:13:50,468 - src.agents.base - INFO - SingleAgent executing tool: ReadFile
2026-01-16 21:13:50,469 - src.agents.base - INFO - Tool arguments:
{
  "file_path": "jupyter_core/utils.py",
  "start_line": 1,
  "end_line": 60
}
2026-01-16 21:13:50,469 - src.agents.base - INFO - Tool arguments:
{
  "file_path": "jupyter_core/utils.py",
  "start_line": 1,
  "end_line": 60
}
2026-01-16 21:13:50,626 - src.agents.base - INFO - Tool ReadFile: ✗
2026-01-16 21:13:50,626 - src.agents.base - INFO - Tool ReadFile: ✗
2026-01-16 21:13:50,626 - src.agents.base - INFO - Tool ReadFile error: Failed to read file 'jupyter_core/utils.py': sed: can't read jupyter_core/utils.py: No such file or directory

2026-01-16 21:13:50,626 - src.agents.base - INFO - Tool ReadFile error: Failed to read file 'jupyter_core/utils.py': sed: can't read jupyter_core/utils.py: No such file or directory

2026-01-16 21:13:51,528 - src.agents.base - INFO - SingleAgent executing tool: ReadFile
2026-01-16 21:13:51,528 - src.agents.base - INFO - SingleAgent executing tool: ReadFile
2026-01-16 21:13:51,529 - src.agents.base - INFO - Tool arguments:
{
  "file_path": "tests/test_application.py",
  "start_line": 1,
  "end_line": 60
}
2026-01-16 21:13:51,529 - src.agents.base - INFO - Tool arguments:
{
  "file_path": "tests/test_application.py",
  "start_line": 1,
  "end_line": 60
}
2026-01-16 21:13:51,678 - src.agents.base - INFO - Tool ReadFile: ✗
2026-01-16 21:13:51,678 - src.agents.base - INFO - Tool ReadFile: ✗
2026-01-16 21:13:51,678 - src.agents.base - INFO - Tool ReadFile error: Failed to read file 'tests/test_application.py': sed: can't read tests/test_application.py: No such file or directory

2026-01-16 21:13:51,678 - src.agents.base - INFO - Tool ReadFile error: Failed to read file 'tests/test_application.py': sed: can't read tests/test_application.py: No such file or directory

2026-01-16 21:13:52,683 - src.agents.base - INFO - SingleAgent executing tool: ReadFile
2026-01-16 21:13:52,683 - src.agents.base - INFO - SingleAgent executing tool: ReadFile
2026-01-16 21:13:52,683 - src.agents.base - INFO - Tool arguments:
{
  "file_path": "tests",
  "start_line": 1,
  "end_line": 20
}
2026-01-16 21:13:52,683 - src.agents.base - INFO - Tool arguments:
{
  "file_path": "tests",
  "start_line": 1,
  "end_line": 20
}
2026-01-16 21:13:52,830 - src.agents.base - INFO - Tool ReadFile: ✗
2026-01-16 21:13:52,830 - src.agents.base - INFO - Tool ReadFile: ✗
2026-01-16 21:13:52,830 - src.agents.base - INFO - Tool ReadFile error: Failed to read file 'tests': sed: can't read tests: No such file or directory

2026-01-16 21:13:52,830 - src.agents.base - INFO - Tool ReadFile error: Failed to read file 'tests': sed: can't read tests: No such file or directory

2026-01-16 21:13:53,908 - src.agents.base - INFO - SingleAgent executing tool: ReadFile
2026-01-16 21:13:53,908 - src.agents.base - INFO - SingleAgent executing tool: ReadFile
2026-01-16 21:13:53,908 - src.agents.base - INFO - Tool arguments:
{
  "file_path": "jupyter_core/application.py",
  "start_line": 301,
  "end_line": 400
}
2026-01-16 21:13:53,908 - src.agents.base - INFO - Tool arguments:
{
  "file_path": "jupyter_core/application.py",
  "start_line": 301,
  "end_line": 400
}
2026-01-16 21:13:54,065 - src.agents.base - INFO - Tool ReadFile: ✓
2026-01-16 21:13:54,065 - src.agents.base - INFO - Tool ReadFile: ✓
2026-01-16 21:13:55,136 - src.agents.base - INFO - SingleAgent executing tool: ReadFile
2026-01-16 21:13:55,136 - src.agents.base - INFO - SingleAgent executing tool: ReadFile
2026-01-16 21:13:55,136 - src.agents.base - INFO - Tool arguments:
{
  "file_path": "jupyter_core/application.py",
  "start_line": 1,
  "end_line": 400
}
2026-01-16 21:13:55,136 - src.agents.base - INFO - Tool arguments:
{
  "file_path": "jupyter_core/application.py",
  "start_line": 1,
  "end_line": 400
}
2026-01-16 21:13:55,278 - src.agents.base - INFO - Tool ReadFile: ✓
2026-01-16 21:13:55,278 - src.agents.base - INFO - Tool ReadFile: ✓
2026-01-16 21:13:56,549 - src.agents.base - INFO - SingleAgent executing tool: RunTest
2026-01-16 21:13:56,549 - src.agents.base - INFO - SingleAgent executing tool: RunTest
2026-01-16 21:13:56,549 - src.agents.base - INFO - Tool arguments:
{
  "run_prepare": true,
  "timeout": 120,
  "include_paths": [
    "jupyter_core/application.py"
  ],
  "run_unittest": true
}
2026-01-16 21:13:56,549 - src.agents.base - INFO - Tool arguments:
{
  "run_prepare": true,
  "timeout": 120,
  "include_paths": [
    "jupyter_core/application.py"
  ],
  "run_unittest": true
}
2026-01-16 21:13:56,863 - src.tools.run_test - INFO - Extracted 1 file paths from /workspace/test.patch: ['jupyter_core/tests/test_application.py']
2026-01-16 21:13:56,863 - src.tools.run_test - INFO - Extracted 1 file paths from /workspace/test.patch: ['jupyter_core/tests/test_application.py']
2026-01-16 21:13:56,863 - src.tools.run_test - INFO - Generating git diff for fix.patch
2026-01-16 21:13:56,863 - src.tools.run_test - INFO - Generating git diff for fix.patch
2026-01-16 21:13:56,863 - src.tools.run_test - INFO -   include_paths: ['jupyter_core/application.py']
2026-01-16 21:13:56,863 - src.tools.run_test - INFO -   include_paths: ['jupyter_core/application.py']
2026-01-16 21:13:56,863 - src.tools.run_test - INFO -   exclude_paths (from test.patch): ['jupyter_core/tests/test_application.py']
2026-01-16 21:13:56,863 - src.tools.run_test - INFO -   exclude_paths (from test.patch): ['jupyter_core/tests/test_application.py']
2026-01-16 21:13:56,864 - src.tools.run_test - INFO -   git diff command: git diff HEAD -- 'jupyter_core/application.py' ':(exclude)jupyter_core/tests/test_application.py'
2026-01-16 21:13:56,864 - src.tools.run_test - INFO -   git diff command: git diff HEAD -- 'jupyter_core/application.py' ':(exclude)jupyter_core/tests/test_application.py'
2026-01-16 21:13:57,007 - src.tools.run_test - WARNING -   No diff generated (exit_code=0, output_len=0)
2026-01-16 21:13:57,007 - src.tools.run_test - WARNING -   No diff generated (exit_code=0, output_len=0)
2026-01-16 21:13:57,008 - src.agents.base - INFO - Tool RunTest: ✗
2026-01-16 21:13:57,008 - src.agents.base - INFO - Tool RunTest: ✗
2026-01-16 21:13:57,008 - src.agents.base - INFO - Tool RunTest error: No patch diff found. Please apply code changes using EditCode before running tests. The fix-run.sh script expects a patch at /workspace/fix.patch.
2026-01-16 21:13:57,008 - src.agents.base - INFO - Tool RunTest error: No patch diff found. Please apply code changes using EditCode before running tests. The fix-run.sh script expects a patch at /workspace/fix.patch.
2026-01-16 21:14:04,046 - src.agents.base - INFO - SingleAgent executing tool: EditCode
2026-01-16 21:14:04,046 - src.agents.base - INFO - SingleAgent executing tool: EditCode
2026-01-16 21:14:04,047 - src.agents.base - INFO - Tool arguments:
{
  "file_path": "jupyter_core/application.py",
  "old_code": "    def config_file_paths(self):\n        path = jupyter_config_path()\n        if self.config_dir not in path:\n            path.insert(0, self.config_dir)\n        path.insert(0, os.getcwd())\n        return path",
  "new_code": "    def config_file_paths(self):\n        path = jupyter_config_path()\n        if self.config_dir not in path:\n            path.insert(0, self.config_dir)\n        # Removed insecure addition of current working directory to config path (CVE-2022-39286)\n        return path",
  "fuzzy_match": true,
  "skip_validation": false
}
2026-01-16 21:14:04,047 - src.agents.base - INFO - Tool arguments:
{
  "file_path": "jupyter_core/application.py",
  "old_code": "    def config_file_paths(self):\n        path = jupyter_config_path()\n        if self.config_dir not in path:\n            path.insert(0, self.config_dir)\n        path.insert(0, os.getcwd())\n        return path",
  "new_code": "    def config_file_paths(self):\n        path = jupyter_config_path()\n        if self.config_dir not in path:\n            path.insert(0, self.config_dir)\n        # Removed insecure addition of current working directory to config path (CVE-2022-39286)\n        return path",
  "fuzzy_match": true,
  "skip_validation": false
}
2026-01-16 21:14:04,170 - src.tools.edit_code - INFO - EditCodeTool: Writing 8332 chars to jupyter_core/application.py (match_type=exact)
2026-01-16 21:14:04,170 - src.tools.edit_code - INFO - EditCodeTool: Writing 8332 chars to jupyter_core/application.py (match_type=exact)
2026-01-16 21:14:04,298 - src.agents.base - INFO - Tool EditCode: ✓
2026-01-16 21:14:04,298 - src.agents.base - INFO - Tool EditCode: ✓
2026-01-16 21:14:06,404 - src.agents.base - INFO - SingleAgent executing tool: RunTest
2026-01-16 21:14:06,404 - src.agents.base - INFO - SingleAgent executing tool: RunTest
2026-01-16 21:14:06,404 - src.agents.base - INFO - Tool arguments:
{
  "run_prepare": true,
  "timeout": 120,
  "include_paths": [
    "jupyter_core/application.py"
  ],
  "run_unittest": true
}
2026-01-16 21:14:06,404 - src.agents.base - INFO - Tool arguments:
{
  "run_prepare": true,
  "timeout": 120,
  "include_paths": [
    "jupyter_core/application.py"
  ],
  "run_unittest": true
}
2026-01-16 21:14:06,743 - src.tools.run_test - INFO - Extracted 1 file paths from /workspace/test.patch: ['jupyter_core/tests/test_application.py']
2026-01-16 21:14:06,743 - src.tools.run_test - INFO - Extracted 1 file paths from /workspace/test.patch: ['jupyter_core/tests/test_application.py']
2026-01-16 21:14:06,744 - src.tools.run_test - INFO - Generating git diff for fix.patch
2026-01-16 21:14:06,744 - src.tools.run_test - INFO - Generating git diff for fix.patch
2026-01-16 21:14:06,744 - src.tools.run_test - INFO -   include_paths: ['jupyter_core/application.py']
2026-01-16 21:14:06,744 - src.tools.run_test - INFO -   include_paths: ['jupyter_core/application.py']
2026-01-16 21:14:06,744 - src.tools.run_test - INFO -   exclude_paths (from test.patch): ['jupyter_core/tests/test_application.py']
2026-01-16 21:14:06,744 - src.tools.run_test - INFO -   exclude_paths (from test.patch): ['jupyter_core/tests/test_application.py']
2026-01-16 21:14:06,744 - src.tools.run_test - INFO -   git diff command: git diff HEAD -- 'jupyter_core/application.py' ':(exclude)jupyter_core/tests/test_application.py'
2026-01-16 21:14:06,744 - src.tools.run_test - INFO -   git diff command: git diff HEAD -- 'jupyter_core/application.py' ':(exclude)jupyter_core/tests/test_application.py'
2026-01-16 21:14:06,879 - src.tools.run_test - INFO -   Generated patch: 526 bytes, 13 lines
2026-01-16 21:14:06,879 - src.tools.run_test - INFO -   Generated patch: 526 bytes, 13 lines
2026-01-16 21:14:06,879 - src.tools.run_test - INFO -   Patch content:
diff --git a/jupyter_core/application.py b/jupyter_core/application.py
index cb46d12..8f6e93b 100644
--- a/jupyter_core/application.py
+++ b/jupyter_core/application.py
@@ -89,7 +89,7 @@ class JupyterApp(Application):
         path = jupyter_config_path()
         if self.config_dir not in path:
             path.insert(0, self.config_dir)
-        path.insert(0, os.getcwd())
+        # Removed insecure addition of current working directory to config path (CVE-2022-39286)
         return path
 
     data_dir = Unicode()

2026-01-16 21:14:06,879 - src.tools.run_test - INFO -   Patch content:
diff --git a/jupyter_core/application.py b/jupyter_core/application.py
index cb46d12..8f6e93b 100644
--- a/jupyter_core/application.py
+++ b/jupyter_core/application.py
@@ -89,7 +89,7 @@ class JupyterApp(Application):
         path = jupyter_config_path()
         if self.config_dir not in path:
             path.insert(0, self.config_dir)
-        path.insert(0, os.getcwd())
+        # Removed insecure addition of current working directory to config path (CVE-2022-39286)
         return path
 
     data_dir = Unicode()

2026-01-16 21:14:06,969 - src.tools.run_test - INFO - Running prepare.sh to reset repository...
2026-01-16 21:14:06,969 - src.tools.run_test - INFO - Running prepare.sh to reset repository...
2026-01-16 21:14:07,408 - src.tools.run_test - INFO - Running fix-run.sh for PoC validation...
2026-01-16 21:14:07,408 - src.tools.run_test - INFO - Running fix-run.sh for PoC validation...
2026-01-16 21:14:07,504 - src.tools.run_test - INFO - Patch being tested:
diff --git a/jupyter_core/application.py b/jupyter_core/application.py
index cb46d12..8f6e93b 100644
--- a/jupyter_core/application.py
+++ b/jupyter_core/application.py
@@ -89,7 +89,7 @@ class JupyterApp(Application):
         path = jupyter_config_path()
         if self.config_dir not in path:
             path.insert(0, self.config_dir)
-        path.insert(0, os.getcwd())
+        # Removed insecure addition of current working directory to config path (CVE-2022-39286)
         return path
 
     data_dir = Unicode()


2026-01-16 21:14:07,504 - src.tools.run_test - INFO - Patch being tested:
diff --git a/jupyter_core/application.py b/jupyter_core/application.py
index cb46d12..8f6e93b 100644
--- a/jupyter_core/application.py
+++ b/jupyter_core/application.py
@@ -89,7 +89,7 @@ class JupyterApp(Application):
         path = jupyter_config_path()
         if self.config_dir not in path:
             path.insert(0, self.config_dir)
-        path.insert(0, os.getcwd())
+        # Removed insecure addition of current working directory to config path (CVE-2022-39286)
         return path
 
     data_dir = Unicode()


2026-01-16 21:14:08,045 - src.tools.run_test - INFO - fix-run.sh completed with exit code 0
2026-01-16 21:14:08,045 - src.tools.run_test - INFO - fix-run.sh completed with exit code 0
2026-01-16 21:14:08,045 - src.tools.run_test - INFO - fix-run.sh output:
[1m============================= test session starts ==============================[0m
platform linux -- Python 3.8.20, pytest-8.3.5, pluggy-1.5.0
rootdir: /workspace/jupyter_core
configfile: pyproject.toml
collected 3 items

jupyter_core/tests/test_application.py [32m.[0m[32m.[0m[32m.[0m[32m                               [100%][0m

============================= slowest 10 durations =============================
0.01s call     jupyter_core/tests/test_application.py::test_load_config

(8 durations < 0.005s hidden.  Use -vv to show these durations.)
[32m============================== [32m[1m3 passed[0m[32m in 0.06s[0m[32m ===============================[0m

2026-01-16 21:14:08,045 - src.tools.run_test - INFO - fix-run.sh output:
[1m============================= test session starts ==============================[0m
platform linux -- Python 3.8.20, pytest-8.3.5, pluggy-1.5.0
rootdir: /workspace/jupyter_core
configfile: pyproject.toml
collected 3 items

jupyter_core/tests/test_application.py [32m.[0m[32m.[0m[32m.[0m[32m                               [100%][0m

============================= slowest 10 durations =============================
0.01s call     jupyter_core/tests/test_application.py::test_load_config

(8 durations < 0.005s hidden.  Use -vv to show these durations.)
[32m============================== [32m[1m3 passed[0m[32m in 0.06s[0m[32m ===============================[0m

2026-01-16 21:14:08,131 - src.tools.run_test - INFO - Running prepare.sh to reset repository...
2026-01-16 21:14:08,131 - src.tools.run_test - INFO - Running prepare.sh to reset repository...
2026-01-16 21:14:08,644 - src.tools.run_test - INFO - Running unit_test.sh for regression testing...
2026-01-16 21:14:08,644 - src.tools.run_test - INFO - Running unit_test.sh for regression testing...
2026-01-16 21:14:09,094 - src.tools.run_test - INFO - unit_test.sh completed with exit code 0
2026-01-16 21:14:09,094 - src.tools.run_test - INFO - unit_test.sh completed with exit code 0
2026-01-16 21:14:09,094 - src.tools.run_test - INFO - unit_test.sh output:
[1m============================= test session starts ==============================[0m
platform linux -- Python 3.8.20, pytest-8.3.5, pluggy-1.5.0
rootdir: /workspace/jupyter_core
configfile: pyproject.toml
collected 8 items / 1 deselected / 7 selected

jupyter_core/tests/test_application.py [32m.[0m[32m.[0m[32m.[0m[32m.[0m[32m.[0m[32m.[0m[32m.[0m[32m                           [100%][0m

============================= slowest 10 durations =============================
0.01s call     jupyter_core/tests/test_application.py::test_custom_config

(9 durations < 0.005s hidden.  Use -vv to show these durations.)
[32m======================= [32m[1m7 passed[0m, [33m1 deselected[0m[32m in 0.05s[0m[32m ========================[0m

2026-01-16 21:14:09,094 - src.tools.run_test - INFO - unit_test.sh output:
[1m============================= test session starts ==============================[0m
platform linux -- Python 3.8.20, pytest-8.3.5, pluggy-1.5.0
rootdir: /workspace/jupyter_core
configfile: pyproject.toml
collected 8 items / 1 deselected / 7 selected

jupyter_core/tests/test_application.py [32m.[0m[32m.[0m[32m.[0m[32m.[0m[32m.[0m[32m.[0m[32m.[0m[32m                           [100%][0m

============================= slowest 10 durations =============================
0.01s call     jupyter_core/tests/test_application.py::test_custom_config

(9 durations < 0.005s hidden.  Use -vv to show these durations.)
[32m======================= [32m[1m7 passed[0m, [33m1 deselected[0m[32m in 0.05s[0m[32m ========================[0m

2026-01-16 21:14:09,094 - src.agents.base - INFO - Tool RunTest: ✓
2026-01-16 21:14:09,094 - src.agents.base - INFO - Tool RunTest: ✓
2026-01-16 21:14:13,608 - src.agents.base - INFO - SingleAgent - LLM response (1129 chars):
```json
{
  "status": "success",
  "vulnerability": "Jupyter applications loaded config files from the current working directory, allowing untrusted code execution (CWE-285, CWE-250, CWE-269, CVE-2022-39286).",
  "fix": "Removed the addition of the current working directory to the config file search path, preventing untrusted config loading.",
  "iterations": 1,
  "files_modified": ["jupyter_core/application.py"],
  "verification": {
    "poc_passed": true,
    "regression_passed": true
  }
}
```
**Verification Output:**
```json
{
  "poc_result": {
    "passed": true,
    "vulnerability_fixed": true,
    "analysis": "fix-run.sh: All PoC tests passed (3/3), no errors or failures."
  },
  "regression_result": {
    "passed": true,
    "tests_present": true,
    "analysis": "unit_test.sh: All relevant unit tests passed (7/7), 1 test deselected, no errors or failures."
  },
  "overall_verdict": "PASS"
}
```
**Summary:**  
The vulnerability was fixed by removing the insecure addition of the current working directory to the config search path. All PoC and regression tests passed, confirming the fix and no regressions.
2026-01-16 21:14:13,608 - src.agents.base - INFO - SingleAgent - LLM response (1129 chars):
```json
{
  "status": "success",
  "vulnerability": "Jupyter applications loaded config files from the current working directory, allowing untrusted code execution (CWE-285, CWE-250, CWE-269, CVE-2022-39286).",
  "fix": "Removed the addition of the current working directory to the config file search path, preventing untrusted config loading.",
  "iterations": 1,
  "files_modified": ["jupyter_core/application.py"],
  "verification": {
    "poc_passed": true,
    "regression_passed": true
  }
}
```
**Verification Output:**
```json
{
  "poc_result": {
    "passed": true,
    "vulnerability_fixed": true,
    "analysis": "fix-run.sh: All PoC tests passed (3/3), no errors or failures."
  },
  "regression_result": {
    "passed": true,
    "tests_present": true,
    "analysis": "unit_test.sh: All relevant unit tests passed (7/7), 1 test deselected, no errors or failures."
  },
  "overall_verdict": "PASS"
}
```
**Summary:**  
The vulnerability was fixed by removing the insecure addition of the current working directory to the config search path. All PoC and regression tests passed, confirming the fix and no regressions.
2026-01-16 21:14:13,610 - orchestrator - INFO - Completed: Sample: CVE-2022-39286 | Status: success | Rounds: 2 | Duration: 39.7s
2026-01-16 21:14:13,610 - orchestrator - INFO - Completed: Sample: CVE-2022-39286 | Status: success | Rounds: 2 | Duration: 39.7s
2026-01-16 21:14:13,755 - __main__ - INFO - Extracted patch via /workspace/fix.patch (527 bytes)
